{"binding":{"evidenceCatalogSha256":"ceba5b655c1e0fd8098fb6af050bfc9197723a2179e74cefd6c7a67fc78d6172","mediaDurationMs":1336170,"sourceIdentity":"portal:bilibili:BV1qM9fB8Eb2:38063116031:p1","spanEndMs":1336170,"spanStartMs":300,"taskId":"media_task_99cf218e9b2b411e84f62d7bff24a489","taskRevision":7},"brief":{"evidenceIds":["mtr_b2e1fa0715d67746cc558ef1ab558823","mtr_7d843ac538b56f9fb6e786fcc7ccd45b","mtr_b84dbe1da0518c598dbececb742cc573","mtr_900ce64f7fe226be3bffc70f5916db78","mtr_32f1b84656226d6ac25d36b44848a2bc","mtr_364875b3da0412dd500e706e294a53dc"],"origin":"provider","regions":["opening","middle","ending"],"sourceClaimIds":[],"text":"本教程系统讲解updream的Agent需求规划、无限画布节点、图片与视频生成、项目及资产管理，并说明技能调用、参数计费、积分获取、会员成本、现有限制与官方客服支持。"},"chapters":[{"chapterId":"chapter_818d687aa0abaca0","endMs":328400,"evidenceIds":["mtr_b2e1fa0715d67746cc558ef1ab558823","mtr_5ff33c6d587a367eb864b5eb7fdd24f2","mtr_8d1e3024f8c019adcea33a36e77aa3b0","mtr_7427ab465990ea3a073cdc91215c7bec","mtr_94c3f35cd0f297de91c52db7a8b02258","mev_df6b13b89530cf3f5c15c19f9401bb09","mev_f8e2cd2934080990157aa8d33511a356","mtr_e5b0bf10b321c38c3e1bacac95cbb68c"],"order":0,"relationToPrevious":"opening","startMs":300,"thesis":"updream是以Agent为核心、整合多模型与节点工作流的在线AI创作平台，用户可从对话框输入创意并由Agent追问、规划和确认执行。","title":"平台定位与Agent规划入口"},{"chapterId":"chapter_e1f999c8d1306e80","endMs":484100,"evidenceIds":["mtr_7d843ac538b56f9fb6e786fcc7ccd45b","mtr_7664c448f35e3e4b033848e6f35ed37d","mtr_16db12136fa7016e7c683648877ea7d5","mtr_38c2192a0eb6d7ff708e3c8039cf80da","mtr_01eb52969b3e5a98ab11e2487504c230","mtr_eaefd00a4bebba4aea6271f51b91ac80","mtr_992806d0048e7cb2185152ae37dea04c","mtr_a5bd6b8ad2266c3eaf2d05c94e4fc685"],"order":1,"relationToPrevious":"continuation","startMs":328400,"thesis":"无限画布及其节点和连线机制比纯对话更直观，能够连接文本、图片等不同模态素材并逐步组成可复用的创作工作流。","title":"无限画布与节点式创作"},{"chapterId":"chapter_4ce2c2991747e5ad","endMs":738800,"evidenceIds":["mtr_be8c19300d4c6623b475a94f7c33bec5","mtr_bdce437f9bc3ff8f630894c1426a9fad","mtr_c550c2b2d5c830f3f249148a97d38eb9","mtr_2f52126efbeccdcd506bad8e38d689af","mtr_303f51d552a4ad31dd254789795465bd","mtr_dfec3104a89257433edb751bd9ec072a","mtr_cf1330bd222e2a7753fed9a28d51f7ce","mtr_b84dbe1da0518c598dbececb742cc573","mtr_b9ba406ff53f1f25c1045039c49fd64a","mtr_37b0354c4210a4e754dcf3e9ffe923d5","mtr_f2d94e302797a8a1c7bb8e93d0d7a289","mtr_900ce64f7fe226be3bffc70f5916db78"],"order":2,"relationToPrevious":"continuation","startMs":484100,"thesis":"图片和视频节点覆盖模型生成、编辑、多图参考及分镜衔接，而高质量且经济的视频产出依赖预先规划并减少试错废片。","title":"图片视频生成与分镜衔接"},{"chapterId":"chapter_fb82c073070621a9","endMs":946170,"evidenceIds":["mtr_900ce64f7fe226be3bffc70f5916db78","mtr_369ec636289f2a3a8253987abd7db669","mtr_f3921d9d5ddb95b6818b1ae3a64182d9","mtr_5faf7b751011eaf650e4392e4bb9057c","mtr_05066f529491ef05f21633f8183ec32d","mtr_af5e858254b6d11ef53ac0627a80c07c","mtr_c18d01e4a9e61fad6a8078adb48121e5","mtr_69770548b64723bac1a780342947b3d2","mtr_3f9a7b0b7361872c7607e14271d0b95d"],"order":3,"relationToPrevious":"cause_effect","startMs":738800,"thesis":"生成历史、分镜管理和分层资产库共同支撑复杂项目，使Agent产出可追踪、可回退，并允许角色等素材跨项目复用，但项目素材和分镜目前不能直接拖入画布。","title":"分镜项目与资产管理"},{"chapterId":"chapter_af4d27b05caa82a3","endMs":1117830,"evidenceIds":["mtr_821959b17199483866e9f58d8fc7fff1","mtr_56811109277418971ee227946d3db818","mtr_29490cf39bb7d650f583cde3c13cfed6","mtr_131e88162bc2909ad53c723f807bc9e4","mtr_32f1b84656226d6ac25d36b44848a2bc","mev_3c9c50e9c8eacec4099efc79db3460f9","mev_64e8d0a151582376940bc5fcd9015347","mtr_84aab92c49e19520ea90e15169a05535","mtr_cbcff70373bdea54789711f036093021","mtr_c91d7e18f7197959a1408f1cbee8cd2a"],"order":4,"relationToPrevious":"continuation","startMs":946170,"thesis":"用户可激活专项skill辅助创作，但Agent在生图或生视频阶段只能允许或取消，因此应预先设置模型、分辨率和质量，并结合计费表控制积分消耗。","title":"技能调用与参数计费"},{"chapterId":"chapter_c6017bcb06193b63","endMs":1336170,"evidenceIds":["mtr_5bf3241db8c54f125b4e66e71c0272c7","mtr_15885cde951a980c58cedfdf7b8a9a6d","mtr_788a5d327a7567afbf5710ad3b336b69","mev_c80d7dc8d874d1b041030c447ba55671","mev_fea9fffa99af01b62d53fe69722bc078","mtr_364875b3da0412dd500e706e294a53dc","mtr_72132a71c016a64ceeb7b7fafc525bfe","mtr_5584798115f000e851f1b0def2c766a4","mtr_0bea28309d2c5b4cf14a295b08afe792","mtr_dfdaa80c98a48037229695fd57801a8d","mtr_af84c3230eb4eb013cdd324b2b3f093e","mtr_2f6b1a16fc123ffe20df429bceaa8618"],"order":5,"relationToPrevious":"conclusion","startMs":1117830,"thesis":"用户可通过活动、邀请和会员获得积分并控制成本，平台仍有积分显示、默认模型和素材交互等问题，但真人客服与官方手册提供了有效支持。","title":"积分成本、现有限制与客服支持"}],"claims":[{"claimId":"claim_dbb3ee7b341f8f74","evidenceIds":["mtr_b2e1fa0715d67746cc558ef1ab558823","mtr_5ff33c6d587a367eb864b5eb7fdd24f2","mtr_8d1e3024f8c019adcea33a36e77aa3b0"],"regions":["opening"],"text":"updream由Bilibili推出，定位为以AI智能体、节点式全链路创作和多模型调用为核心的在线创作平台。"},{"claimId":"claim_64fbe8e87d32880c","evidenceIds":["mtr_7427ab465990ea3a073cdc91215c7bec","mtr_94c3f35cd0f297de91c52db7a8b02258","mtr_7d843ac538b56f9fb6e786fcc7ccd45b","mtr_7664c448f35e3e4b033848e6f35ed37d"],"regions":["opening"],"text":"Agent可先追问需求再规划执行，而无限画布允许通过文本、图片等节点及连线组织创作流程。"},{"claimId":"claim_12e562750530a23a","evidenceIds":["mtr_be8c19300d4c6623b475a94f7c33bec5","mtr_b84dbe1da0518c598dbececb742cc573","mtr_b9ba406ff53f1f25c1045039c49fd64a"],"regions":["middle"],"text":"图片节点支持多模型生成、二次编辑和多图参考，视频节点支持参考生成、分镜控制、后期编辑及抽帧衔接。"},{"claimId":"claim_15da381184fa081c","evidenceIds":["mtr_900ce64f7fe226be3bffc70f5916db78","mtr_369ec636289f2a3a8253987abd7db669","mtr_3f9a7b0b7361872c7607e14271d0b95d"],"regions":["middle","ending"],"text":"生成历史、分镜面板和分层资产库支撑复杂项目，但项目素材与分镜目前不能直接从管理面板拖入画布。"},{"claimId":"claim_e3e2e8900f75397c","evidenceIds":["mtr_32f1b84656226d6ac25d36b44848a2bc","mtr_84aab92c49e19520ea90e15169a05535","mtr_cbcff70373bdea54789711f036093021","mtr_788a5d327a7567afbf5710ad3b336b69"],"regions":["ending"],"text":"Agent执行中不能临时更换模型，因此应预设模型和质量，并通过计费表、会员与积分活动控制生成成本。"}],"quality":{"failureCodes":[],"humanReviewRequired":true,"maxChapterSpanRatio":0.245608,"maxChapterStartConcentration":0.333333,"sourceCoverageRatio":1.0,"status":"complete"},"receipt":{"apiKeyDisclosureCount":0,"attemptId":"attempt-2971dbc33da7ff98","cookieUploadCount":0,"endpointClass":"minimax_chat_completions","finishReason":"stop","frameByteUploadCount":0,"latencyMs":17245,"localPathUploadCount":0,"modelId":"MiniMax-M3","outboundDerivedTextSha256":"4e6791df57136c6b7503fdaa54bbfc3ca27765bb1c433ac69765c128ea2f8157","providerId":"minimax-cn-openai-vision","rawAudioUploadCount":0,"rawVideoUploadCount":0,"requestCount":6,"requestSha256":"4e6791df57136c6b7503fdaa54bbfc3ca27765bb1c433ac69765c128ea2f8157","responseSha256":"b7007b7a4f81b9b231895857ca3c66982569c343501419b7af72aa611ddee38b","structureMode":"openai_chat_object"},"regions":[{"availability":"substantive","endMs":445590,"evidenceIds":["mtr_b2e1fa0715d67746cc558ef1ab558823","mtr_5ff33c6d587a367eb864b5eb7fdd24f2","mtr_8d1e3024f8c019adcea33a36e77aa3b0","mtr_67cdcc4a9f5fa0f7ad7c78e3dd0aaeb9","mtr_34c8d7e084706654c3616a87a4311d52","mtr_4c161114b29e1500fd284cb1f85213d7","mev_3a614d6b524099441da7018d5f0a5215","mev_5ea81bba276432184fc9943b4f268770","mtr_7427ab465990ea3a073cdc91215c7bec","mtr_94c3f35cd0f297de91c52db7a8b02258","mev_df6b13b89530cf3f5c15c19f9401bb09","mev_f8e2cd2934080990157aa8d33511a356","mtr_e5b0bf10b321c38c3e1bacac95cbb68c","mtr_7d843ac538b56f9fb6e786fcc7ccd45b","mtr_7664c448f35e3e4b033848e6f35ed37d","mtr_16db12136fa7016e7c683648877ea7d5","mtr_38c2192a0eb6d7ff708e3c8039cf80da","mtr_01eb52969b3e5a98ab11e2487504c230","mtr_eaefd00a4bebba4aea6271f51b91ac80","mtr_992806d0048e7cb2185152ae37dea04c","mev_99984b7bf441b2a797cf02360f4a9a9c","mev_9efc0e92c1fee902cc522268fd622e39"],"name":"opening","startMs":300},{"availability":"substantive","endMs":890880,"evidenceIds":["mtr_992806d0048e7cb2185152ae37dea04c","mtr_a5bd6b8ad2266c3eaf2d05c94e4fc685","mtr_be8c19300d4c6623b475a94f7c33bec5","mtr_bdce437f9bc3ff8f630894c1426a9fad","mtr_c550c2b2d5c830f3f249148a97d38eb9","mtr_2f52126efbeccdcd506bad8e38d689af","mtr_303f51d552a4ad31dd254789795465bd","mtr_dfec3104a89257433edb751bd9ec072a","mev_525b221e9d6868215bb91888675cfa0f","mev_ae1292d624d1596e3d3730f804ec6a76","mtr_cf1330bd222e2a7753fed9a28d51f7ce","mtr_b84dbe1da0518c598dbececb742cc573","mtr_b9ba406ff53f1f25c1045039c49fd64a","mtr_37b0354c4210a4e754dcf3e9ffe923d5","mtr_f2d94e302797a8a1c7bb8e93d0d7a289","mtr_900ce64f7fe226be3bffc70f5916db78","mev_187f15bf74f211fcb682bb12b03c306e","mev_4638dce661d1a57fdf158d3c3c3b5820","mtr_369ec636289f2a3a8253987abd7db669","mtr_f3921d9d5ddb95b6818b1ae3a64182d9","mtr_5faf7b751011eaf650e4392e4bb9057c","mtr_05066f529491ef05f21633f8183ec32d","mtr_af5e858254b6d11ef53ac0627a80c07c","mtr_c18d01e4a9e61fad6a8078adb48121e5","mtr_69770548b64723bac1a780342947b3d2","mev_3924ed9b73c75b3167119925bfa40f97","mev_f520bbdbe68163ebbb330377423c989e"],"name":"middle","startMs":445590},{"availability":"substantive","endMs":1336170,"evidenceIds":["mtr_69770548b64723bac1a780342947b3d2","mtr_3f9a7b0b7361872c7607e14271d0b95d","mtr_7906bb74627cfb0e1a5c59920c9d71ea","mtr_821959b17199483866e9f58d8fc7fff1","mtr_56811109277418971ee227946d3db818","mtr_29490cf39bb7d650f583cde3c13cfed6","mtr_131e88162bc2909ad53c723f807bc9e4","mtr_32f1b84656226d6ac25d36b44848a2bc","mev_3c9c50e9c8eacec4099efc79db3460f9","mev_64e8d0a151582376940bc5fcd9015347","mtr_84aab92c49e19520ea90e15169a05535","mtr_cbcff70373bdea54789711f036093021","mtr_c91d7e18f7197959a1408f1cbee8cd2a","mtr_5bf3241db8c54f125b4e66e71c0272c7","mtr_15885cde951a980c58cedfdf7b8a9a6d","mtr_788a5d327a7567afbf5710ad3b336b69","mev_c80d7dc8d874d1b041030c447ba55671","mev_fea9fffa99af01b62d53fe69722bc078","mtr_364875b3da0412dd500e706e294a53dc","mtr_72132a71c016a64ceeb7b7fafc525bfe","mtr_5584798115f000e851f1b0def2c766a4","mtr_0bea28309d2c5b4cf14a295b08afe792","mtr_dfdaa80c98a48037229695fd57801a8d","mtr_af84c3230eb4eb013cdd324b2b3f093e","mtr_2f6b1a16fc123ffe20df429bceaa8618"],"name":"ending","startMs":890880}],"schemaVersion":"v3-media-grounded-comprehension/v2.1"}