{"binding":{"evidenceCatalogSha256":"96658ee3382f6ba3a94542f3d3377fbb340e5e52b297108d4c19a95dde320b7c","mediaDurationMs":270260,"sourceIdentity":"portal:bilibili:BV1HTbi6LERi:41002929285:p1","spanEndMs":270260,"spanStartMs":60,"taskId":"media_task_53e62c64dcb1475c9617cf80018a5c9e","taskRevision":7},"brief":{"evidenceIds":["mtr_162970b6f9302c8be54377b2b99f8126","mtr_03eae81c931abad2c2babaf360e00b87","mtr_96ded22bc418be7524a7683f6526fdf8","mtr_8121ce2432260e14996f3e236868d85e","mtr_0a0d76755bb59459be2840752b20b09e","mtr_8ec3ad833a4f9ab8886833a476171f52","mtr_ba0f507344410cb8b71a472d90893975","mtr_e7aa27542e3af84b9d7bcae93910fdf2","mtr_babc7f80cbba3bd1408c560c30fda33b","mtr_0ed55014c5502867f5a1a0b05664ab19","mtr_3bbe8c2a9b2cfb1493f984c81f996705","mtr_5ab4b37c34023854ce2e8f55f39ad97d","mtr_c75812411c19f265c1f9b65aaccc4c13"],"origin":"provider","regions":["opening","middle","ending"],"sourceClaimIds":[],"text":"视频面向创作新人，讲解如何从书籍、论文及引用关系建立资料库，核验专业信息，并选择影视、游戏录屏、AI生成和BGM等素材；同时强调追溯来源、控制版权风险与长期积累。"},"chapters":[{"chapterId":"chapter_c0277ba44f4070cd","endMs":39810,"evidenceIds":["mtr_162970b6f9302c8be54377b2b99f8126","mtr_03eae81c931abad2c2babaf360e00b87"],"order":0,"relationToPrevious":"opening","startMs":60,"thesis":"知识类视频应先从书籍和论文建立资料渠道，再利用关键词定位书内内容。","title":"从书籍论文建立资料渠道"},{"chapterId":"chapter_6a53e1be95bf99d5","endMs":56320,"evidenceIds":["mtr_96ded22bc418be7524a7683f6526fdf8","mev_91bde1a5e0cbc50b2a40193fe28cf43d","mev_9624d615da0c2a63a5a697e110c41c1a","mev_f784b29c312fc26cd909d6e19514cc30"],"order":1,"relationToPrevious":"continuation","startMs":39810,"thesis":"电子书可依次尝试资源站、群聊或朋友分享、搜索引擎，必要时再付费获取。","title":"电子书的分级获取路径"},{"chapterId":"chapter_717eb6ba0639f1a5","endMs":102520,"evidenceIds":["mtr_8121ce2432260e14996f3e236868d85e","mtr_0a0d76755bb59459be2840752b20b09e","mev_0a109e83865bef6fc08eed8e48a99ca1","mev_263ccc4c03cec9a64af130057ae644ea","mev_6a7b78a6c549e6d0a5307bb440325c77"],"order":2,"relationToPrevious":"cause_effect","startMs":56320,"thesis":"沿书籍、论文和百科条目的引用关系继续追溯，可通过树状搜索扩充同领域资料库。","title":"沿引用关系扩展资料库"},{"chapterId":"chapter_6a786ef4fe8fed88","endMs":142169,"evidenceIds":["mtr_8ec3ad833a4f9ab8886833a476171f52","mtr_ba0f507344410cb8b71a472d90893975","mev_267e60fea8966bd62b3aad7a5815eeeb","mev_b3e5fe676dea3ff2c0f734f9d193e255","mev_b4ada58f8a350288834b959cadc5bea2"],"order":3,"relationToPrevious":"continuation","startMs":102520,"thesis":"专业信息应追溯原始权威来源并交叉核验，AI生成资料只能辅助发现线索，不能直接作为事实来源。","title":"专业信息的权威核验"},{"chapterId":"chapter_42098d1c9ac06291","endMs":181320,"evidenceIds":["mtr_e7aa27542e3af84b9d7bcae93910fdf2","mtr_babc7f80cbba3bd1408c560c30fda33b","mev_443aa96bd08473ff4fcfdd084a08647b","mev_aa89afa843edfc54d4bccbeefa62966a","mev_cd683637c58012f85ff65e9d8285935f"],"order":4,"relationToPrevious":"contrast","startMs":142169,"thesis":"影视和纪录片片段可作为素材，但要控制使用长度，并避开高版权风险和不宜大段搬用的内容。","title":"影视素材的版权边界"},{"chapterId":"chapter_9446985a8bb09871","endMs":231960,"evidenceIds":["mtr_0ed55014c5502867f5a1a0b05664ab19","mtr_3bbe8c2a9b2cfb1493f984c81f996705","mev_140b60b6c071c45f0ebe26f683d44917","mev_52322b1602c810d4948292a0176a0e87","mev_df30be8953cc4710a7647635516048b0"],"order":5,"relationToPrevious":"continuation","startMs":181320,"thesis":"免费素材站、游戏录屏和AI生成工具能够补充视频与图片素材，但效果、成本和适用性仍需实际评估。","title":"免费素材与游戏录屏补充"},{"chapterId":"chapter_3836fcc00dd5780e","endMs":270260,"evidenceIds":["mtr_5ab4b37c34023854ce2e8f55f39ad97d","mtr_c75812411c19f265c1f9b65aaccc4c13"],"order":6,"relationToPrevious":"conclusion","startMs":231960,"thesis":"创作应优先采用版权清晰或明确可商用的BGM，并持续积累当前未用但未来可能有用的素材。","title":"BGM版权与素材长期积累"}],"claims":[{"claimId":"claim_871e22b987766115","evidenceIds":["mtr_162970b6f9302c8be54377b2b99f8126","mtr_03eae81c931abad2c2babaf360e00b87"],"regions":["opening"],"text":"知识类视频可从书籍和论文入手，并通过关键词定位电子书中的所需内容。"},{"claimId":"claim_f048f5507ae1ee7f","evidenceIds":["mtr_96ded22bc418be7524a7683f6526fdf8","mev_91bde1a5e0cbc50b2a40193fe28cf43d","mev_f784b29c312fc26cd909d6e19514cc30"],"regions":["opening"],"text":"电子书的获取可依次尝试资源站、资源群或朋友分享、搜索引擎，最后再考虑付费。"},{"claimId":"claim_05d13c661ba7a2dc","evidenceIds":["mtr_8121ce2432260e14996f3e236868d85e","mtr_0a0d76755bb59459be2840752b20b09e"],"regions":["opening","middle"],"text":"沿书籍、论文和百科条目中的来源继续追溯，可通过树状搜索积累同领域资料。"},{"claimId":"claim_aefb560d2ea55a49","evidenceIds":["mtr_8ec3ad833a4f9ab8886833a476171f52","mtr_ba0f507344410cb8b71a472d90893975"],"regions":["middle"],"text":"博物馆官网、学术平台等原始来源可用于核验专业信息；论文需要谨慎筛选，AI生成的资料也应回源检查。"},{"claimId":"claim_f387b161f35671fd","evidenceIds":["mtr_e7aa27542e3af84b9d7bcae93910fdf2","mtr_babc7f80cbba3bd1408c560c30fda33b"],"regions":["middle","ending"],"text":"影视与纪录片片段应避开高版权风险内容，尽量避免大段搬用，并控制单段长度。"},{"claimId":"claim_8fcc2c68662076ae","evidenceIds":["mtr_0ed55014c5502867f5a1a0b05664ab19","mtr_3bbe8c2a9b2cfb1493f984c81f996705"],"regions":["ending"],"text":"免费素材网站、游戏录屏和AI生成可以补充视频与图片素材，但生成效果和使用成本需要实际评估。"},{"claimId":"claim_dca0e6a5061aeeda","evidenceIds":["mtr_5ab4b37c34023854ce2e8f55f39ad97d","mtr_c75812411c19f265c1f9b65aaccc4c13"],"regions":["ending"],"text":"背景音乐应优先选择公开可用或明确可商用的内容，并持续积累暂时未用但未来可能有用的素材。"}],"quality":{"failureCodes":[],"humanReviewRequired":true,"maxChapterSpanRatio":0.187417,"maxChapterStartConcentration":0.285714,"sourceCoverageRatio":1.0,"status":"complete"},"receipt":{"apiKeyDisclosureCount":0,"attemptId":"attempt-f1731582875f6814","cookieUploadCount":0,"endpointClass":"minimax_chat_completions","finishReason":"stop","frameByteUploadCount":0,"latencyMs":9198,"localPathUploadCount":0,"modelId":"MiniMax-M3","outboundDerivedTextSha256":"94df44aacea391151245fb090c4f29ca8111bcf58e8f57fd2466d95f79498eca","providerId":"minimax-cn-openai-vision","rawAudioUploadCount":0,"rawVideoUploadCount":0,"requestCount":4,"requestSha256":"e694c5cdce7d788f366efad49018f4b9accc7584bd0dbfcb02f077ca03c51fc5","responseSha256":"ca96e336b94543c410b988b22f8c50d10890431c3819f99eb07fdba0ab245bd6","structureMode":"openai_chat_object"},"regions":[{"availability":"substantive","endMs":90126,"evidenceIds":["mtr_162970b6f9302c8be54377b2b99f8126","mtr_03eae81c931abad2c2babaf360e00b87","mtr_96ded22bc418be7524a7683f6526fdf8","mev_91bde1a5e0cbc50b2a40193fe28cf43d","mev_f784b29c312fc26cd909d6e19514cc30","mtr_8121ce2432260e14996f3e236868d85e","mtr_0a0d76755bb59459be2840752b20b09e","mev_263ccc4c03cec9a64af130057ae644ea","mev_6a7b78a6c549e6d0a5307bb440325c77"],"name":"opening","startMs":60},{"availability":"substantive","endMs":180193,"evidenceIds":["mtr_0a0d76755bb59459be2840752b20b09e","mtr_8ec3ad833a4f9ab8886833a476171f52","mtr_ba0f507344410cb8b71a472d90893975","mev_b3e5fe676dea3ff2c0f734f9d193e255","mev_b4ada58f8a350288834b959cadc5bea2","mtr_e7aa27542e3af84b9d7bcae93910fdf2","mtr_babc7f80cbba3bd1408c560c30fda33b","mev_aa89afa843edfc54d4bccbeefa62966a","mev_cd683637c58012f85ff65e9d8285935f"],"name":"middle","startMs":90126},{"availability":"substantive","endMs":270260,"evidenceIds":["mtr_babc7f80cbba3bd1408c560c30fda33b","mtr_0ed55014c5502867f5a1a0b05664ab19","mtr_3bbe8c2a9b2cfb1493f984c81f996705","mev_140b60b6c071c45f0ebe26f683d44917","mev_df30be8953cc4710a7647635516048b0","mtr_5ab4b37c34023854ce2e8f55f39ad97d","mtr_c75812411c19f265c1f9b65aaccc4c13"],"name":"ending","startMs":180193}],"schemaVersion":"v3-media-grounded-comprehension/v2.1"}