{"binding":{"evidenceCatalogSha256":"9fe6cb4fd42b9f0713a1a422e096f0c0edac8632184d807c802ed63178f215e8","mediaDurationMs":270260,"sourceIdentity":"portal:bilibili:BV1HTbi6LERi:41002929285:p1","spanEndMs":270260,"spanStartMs":60,"taskId":"media_task_7675614042714e82bf0e0d33d8fd2e59","taskRevision":7},"brief":{"evidenceIds":["mtr_7902beb1dc44688a24e38596ec4ed38e","mtr_371075a0fd4c7b280c8c29a51092a5d2","mtr_c481f30dbe5873bdf6eaa269adde68d5","mtr_66ef574c46fdd72114d05d14cdd71665","mtr_b07669c4d1d6cec8fd61d66740e88bed","mtr_158de611cefcc951d473a662f38ae667","mtr_da6ded260e8b965d43c57152a0e7bf16"],"origin":"provider","regions":["opening","middle","ending"],"sourceClaimIds":[],"text":"视频面向新手创作者，依次讲解书籍论文、百科文章、博物馆和AI的资料检索方法，以及影视、游戏、图片、生成视频与BGM等素材来源，并强调筛选核验、版权规避和持续积累。"},"chapters":[{"chapterId":"chapter_b77cda91c8c272f3","endMs":18890,"evidenceIds":["mtr_7902beb1dc44688a24e38596ec4ed38e"],"order":0,"relationToPrevious":"opening","startMs":60,"thesis":"视频将围绕如何快速掌握基础资料与素材搜索方法，帮助初学者摆脱无从下手的状态。","title":"资料与素材搜索的总体目标"},{"chapterId":"chapter_e7cf4ac394e34954","endMs":56320,"evidenceIds":["mtr_371075a0fd4c7b280c8c29a51092a5d2","mtr_b583986030ee1720aa81856bde9b07d3","mev_2338129514615a43a77cb082e411d31b","mev_5d7edf640d658d58ac3febc9a1ddbf67","mtr_20eeec23cc0b3c6b4b24c522e0aeb461","mtr_bd2c31ee6c3fa3827a0057d2e2ca1ec8"],"order":1,"relationToPrevious":"cause_effect","startMs":18890,"thesis":"书籍和论文是知识类视频的基础资料来源，可通过多种网络渠道获取，但必须筛选论文质量。","title":"电子书与论文的获取渠道"},{"chapterId":"chapter_cb20b1150c8e52c4","endMs":102520,"evidenceIds":["mtr_c481f30dbe5873bdf6eaa269adde68d5","mtr_abf33f50ea664442833a3894b928da1e","mev_37a75d84373317eccb53dec8f39387fb","mev_b8a6b5de58fbeb2dc59ac12b3547c3d5","mev_ecc501c8dac708910418345d244008e6"],"order":2,"relationToPrevious":"continuation","startMs":56320,"thesis":"沿资料来源不断向外追查的树状搜索法能扩展线索，而百科和普通网络文章需要通过来源追溯与交叉验证来降低信息风险。","title":"树状搜索与交叉验证"},{"chapterId":"chapter_1fb16c3ec8e66ce0","endMs":162840,"evidenceIds":["mtr_20eeec23cc0b3c6b4b24c522e0aeb461","mtr_bd2c31ee6c3fa3827a0057d2e2ca1ec8","mev_159f1295320601bc856946f7d964e2d4","mev_8484d3e00e027531e4fc934a73b9a658","mev_c9032df8e47fd5df83df18f7d7de0ec6","mtr_66ef574c46fdd72114d05d14cdd71665"],"order":3,"relationToPrevious":"example","startMs":102520,"thesis":"博物馆官网适合补充文物素材，而AI在资料检索中应限于发现线索和事后检查，不能替代对知识性内容的直接核验。","title":"博物馆官网与AI辅助查资料"},{"chapterId":"chapter_4eba0de1bafc297e","endMs":181320,"evidenceIds":["mtr_8c039384628e43bdd7ce791db58ced52","mev_02ed7d2bfc43422c1a62b443801b2933","mev_32ceb8bb8ff6e8e63a2bf2d303a5a607","mev_ff6e758e5be1be5d9c3d22101cee40c7"],"order":4,"relationToPrevious":"contrast","startMs":162840,"thesis":"影视和纪录片画面可以作为视频素材，但创作者应规避高风险内容、避免大段使用，并尽量利用所在平台已有的版权资源。","title":"视频素材来源与版权规避"},{"chapterId":"chapter_3cf4077721b97127","endMs":231960,"evidenceIds":["mtr_b07669c4d1d6cec8fd61d66740e88bed","mtr_0d663643ff217cd672fcd1cbfffb9add","mev_87205430a13d8f0b8d8df8257d0d641e","mev_dc5fa127a0ba3da029f0a9e47ebef79f","mev_e533832485c74a4e77030d86328e08d3"],"order":5,"relationToPrevious":"continuation","startMs":181320,"thesis":"除影视内容外，免费素材站、游戏官方素材与直接录屏都能扩展素材来源，而AI生成视频适合在能够承受成本时作为补充。","title":"免费素材、游戏画面与AI生成视频"},{"chapterId":"chapter_d638f1cc3ed4cb8c","endMs":255090,"evidenceIds":["mtr_158de611cefcc951d473a662f38ae667"],"order":6,"relationToPrevious":"continuation","startMs":231960,"thesis":"图片可通过搜索或AI生成获取，BGM则应优先使用公开可用、可商用或AI生成的音源，以降低版权风险。","title":"图片生成与BGM版权处理"},{"chapterId":"chapter_6a63e997622a430a","endMs":270260,"evidenceIds":["mtr_da6ded260e8b965d43c57152a0e7bf16"],"order":7,"relationToPrevious":"conclusion","startMs":255090,"thesis":"持续建立自己的资料与素材库，并借助评论区补充渠道，是完成视频创作准备工作的重要方法。","title":"持续积累与问题补充"}],"claims":[{"claimId":"claim_d0826bfd3302e922","evidenceIds":["mtr_371075a0fd4c7b280c8c29a51092a5d2","mtr_b583986030ee1720aa81856bde9b07d3"],"regions":["opening"],"text":"知识类视频应以书籍和论文等基础资料为支撑，并通过资源群、搜索引擎和论文网站寻找内容。"},{"claimId":"claim_60b07bffc3fa6b1f","evidenceIds":["mtr_20eeec23cc0b3c6b4b24c522e0aeb461","mtr_bd2c31ee6c3fa3827a0057d2e2ca1ec8"],"regions":["middle"],"text":"论文质量并不统一，尤其本科论文可能质量较低，使用时需要自行筛选。"},{"claimId":"claim_424e8088d8262b84","evidenceIds":["mtr_c481f30dbe5873bdf6eaa269adde68d5","mtr_abf33f50ea664442833a3894b928da1e"],"regions":["opening","middle"],"text":"沿书籍和论文的来源、参考文献与文献综述继续追查，可以形成不断扩展资料的树状搜索。"},{"claimId":"claim_720ae641077a5393","evidenceIds":["mtr_20eeec23cc0b3c6b4b24c522e0aeb461","mtr_bd2c31ee6c3fa3827a0057d2e2ca1ec8"],"regions":["middle"],"text":"百科和普通网络文章应尽量追溯原始来源并多方交叉验证。"},{"claimId":"claim_412231a7e92d4893","evidenceIds":["mtr_66ef574c46fdd72114d05d14cdd71665","mtr_bd2c31ee6c3fa3827a0057d2e2ca1ec8"],"regions":["middle"],"text":"AI可辅助发现资料线索和检查文案，但用于知识性内容时可能胡编乱造，不能替代直接核验。"},{"claimId":"claim_9f419c7d00368844","evidenceIds":["mtr_8c039384628e43bdd7ce791db58ced52","mev_02ed7d2bfc43422c1a62b443801b2933"],"regions":["middle","ending"],"text":"影视素材应避免大段使用，优先选择发布平台已有版权的资源以降低风险。"},{"claimId":"claim_2ba2fa459994c9dd","evidenceIds":["mtr_b07669c4d1d6cec8fd61d66740e88bed","mtr_0d663643ff217cd672fcd1cbfffb9add"],"regions":["ending"],"text":"免费素材站、游戏宣传片与CG、场景录屏以及AI生成视频，都能用于补充视频素材。"},{"claimId":"claim_2aac0de33cf29220","evidenceIds":["mtr_158de611cefcc951d473a662f38ae667","mtr_da6ded260e8b965d43c57152a0e7bf16"],"regions":["ending"],"text":"图片可通过搜索或AI生成获得，BGM应优先选用公开可用或可商用的音源，并持续保存暂时用不到的素材。"}],"quality":{"failureCodes":[],"humanReviewRequired":true,"maxChapterSpanRatio":0.223242,"maxChapterStartConcentration":0.25,"sourceCoverageRatio":1.0,"status":"complete"},"receipt":{"apiKeyDisclosureCount":0,"attemptId":"attempt-26da7d7120b817af","cookieUploadCount":0,"endpointClass":"minimax_chat_completions","finishReason":"stop","frameByteUploadCount":0,"latencyMs":13518,"localPathUploadCount":0,"modelId":"MiniMax-M3","outboundDerivedTextSha256":"fc8340a3ad15fb45ef0013be5440846e550b0c81078118e0724d4600b4d6373d","providerId":"minimax-cn-openai-vision","rawAudioUploadCount":0,"rawVideoUploadCount":0,"requestCount":2,"requestSha256":"fc8340a3ad15fb45ef0013be5440846e550b0c81078118e0724d4600b4d6373d","responseSha256":"80eaac9f5f8db437c8742ced9ea20bec11efc9239e2333b1d41bf8511757b9cd","structureMode":"openai_chat_object"},"regions":[{"availability":"substantive","endMs":90126,"evidenceIds":["mtr_7902beb1dc44688a24e38596ec4ed38e","mtr_371075a0fd4c7b280c8c29a51092a5d2","mtr_b583986030ee1720aa81856bde9b07d3","mev_2338129514615a43a77cb082e411d31b","mev_5d7edf640d658d58ac3febc9a1ddbf67","mtr_c481f30dbe5873bdf6eaa269adde68d5","mtr_abf33f50ea664442833a3894b928da1e","mev_b8a6b5de58fbeb2dc59ac12b3547c3d5","mev_ecc501c8dac708910418345d244008e6"],"name":"opening","startMs":60},{"availability":"substantive","endMs":180193,"evidenceIds":["mtr_abf33f50ea664442833a3894b928da1e","mtr_20eeec23cc0b3c6b4b24c522e0aeb461","mtr_bd2c31ee6c3fa3827a0057d2e2ca1ec8","mev_8484d3e00e027531e4fc934a73b9a658","mev_c9032df8e47fd5df83df18f7d7de0ec6","mtr_66ef574c46fdd72114d05d14cdd71665","mtr_8c039384628e43bdd7ce791db58ced52","mev_02ed7d2bfc43422c1a62b443801b2933","mev_ff6e758e5be1be5d9c3d22101cee40c7"],"name":"middle","startMs":90126},{"availability":"substantive","endMs":270260,"evidenceIds":["mtr_8c039384628e43bdd7ce791db58ced52","mtr_b07669c4d1d6cec8fd61d66740e88bed","mtr_0d663643ff217cd672fcd1cbfffb9add","mev_87205430a13d8f0b8d8df8257d0d641e","mev_dc5fa127a0ba3da029f0a9e47ebef79f","mtr_158de611cefcc951d473a662f38ae667","mtr_da6ded260e8b965d43c57152a0e7bf16"],"name":"ending","startMs":180193}],"schemaVersion":"v3-media-grounded-comprehension/v2.1"}