{"binding":{"evidenceCatalogSha256":"3fb659cbe12b2d4b5be39278340fc140054b4fe1d4ecafdbd0a214cc54feec33","mediaDurationMs":1181080,"sourceIdentity":"portal:bilibili:BV1QcYx6VEAj:41727364600:p1","spanEndMs":1181080,"spanStartMs":860,"taskId":"media_task_5447499e93ed418f96dbb2b7f9e1adcb","taskRevision":7},"brief":{"evidenceIds":["mtr_c50eedfb1af8041a3a57332ff0be5bf1","mtr_ec795c19738b294d5fefa39a3f80af32","mtr_4c8c3d2cddb01ceb296291f47e121afc","mtr_b26459c8a9cc353997325f0030d882fb","mtr_23ba0180201d44506b40f241cfa0a76e","mtr_0dfb11439ed60760611b4780037ab52c","mtr_c99cce141b99d7533555d1547e4a87d7"],"origin":"provider","regions":["opening","middle","ending"],"sourceClaimIds":[],"text":"视频从产业优势与全民收入的反差切入，借日本产业起飞与汇率变化解释竞争力不等于实际富裕，进而主张以物质供给、生活指标和基础设施衡量发展，并讨论中国的人口、产业与地域约束。"},"chapters":[{"chapterId":"chapter_5c86ceb805c6339d","endMs":222660,"evidenceIds":["mtr_c50eedfb1af8041a3a57332ff0be5bf1","mtr_9c0fbfaa83c4aa86ca5da7ee0b07f81c","mtr_068d01a1171ebbcf55febcdafc77229f","mtr_aaa7824f66beb7b5cde6743f34518b82","mtr_be806dd33c9c083c4290c4763bafc0c6","mtr_617c528971957028e663064ab1caa9c5","mtr_eb17703c542d7565aa1ddedc8c7b7a95","mev_ad15954d7e5e067f6d26ac1feaf6c4be","mev_d70aedbb98234d06c09748dfc7b95045"],"order":0,"relationToPrevious":"opening","startMs":860,"thesis":"中国已在多个产业形成全球竞争力和贸易顺差，但产业优势尚未自动转化为普通人的绝对收入与购买力。","title":"产业领先为何未同步富裕"},{"chapterId":"chapter_1ea52048b83efbf9","endMs":318799,"evidenceIds":["mtr_ec795c19738b294d5fefa39a3f80af32","mtr_785957c11e474a9aaa4733aaa788a0bf","mtr_e01ac39dd19017014ff638fc9dbc2f38","mtr_486eab36202316df1b49c43aaf666653","mev_7b48462bf5e999d7d22148b07760649d","mev_fb5cbe9bbb4d2e8c09cb93c1544a8f4d"],"order":1,"relationToPrevious":"cause_effect","startMs":222660,"thesis":"汽车产业显示中国正从做大走向做强，但行业整合、长期盈利模式及普惠机制仍未成熟。","title":"汽车竞争与产业整合转型"},{"chapterId":"chapter_f23d8d13d5da6c65","endMs":430450,"evidenceIds":["mtr_4c8c3d2cddb01ceb296291f47e121afc","mtr_97ad21b43a479940ab3a9937061c3879","mtr_b227b4af6ba441c4b7879e03cf8f19e1","mtr_1369f47e92acf2cecf7bb722eae8bff0","mev_673a21ab7f298ae10d7540bf123267fd","mev_c7238827d51be399bba7068f7c83414c"],"order":2,"relationToPrevious":"example","startMs":318799,"thesis":"日本产业追赶伴随全产业高速扩张和激烈国际竞争，产业总量跃升并不意味着普通生活同步改善。","title":"日本产业起飞的竞争代价"},{"chapterId":"chapter_b7df1b5546ccc9de","endMs":839400,"evidenceIds":["mtr_b26459c8a9cc353997325f0030d882fb","mtr_5e3bdc8dc6345a130c8df23fc4601463","mtr_e1514f50612b099c69f04af98c5e6f90","mtr_60a107a3b6afd03be63bdceb0da00f69","mtr_1c4dbb9acf2ca42772807bc80c9dc085","mtr_366dd0f7c1d64936b82a9fb61af4c56e","mtr_d6f209839456e4bf7974d9542c3b6347","mtr_04dc864338f471177813844fd18381ce","mtr_585bc047fed80bf20c3059634f89e8cc","mtr_bf6fc13ece750096f41e8fbe76f4f180","mtr_3943bacde0c569031a6ef5faf1260490","mtr_a0a4e4d704b22b8fdae8ca6608a714dd","mtr_09fab8c0aff696d64f254214aa24b9d2","mtr_4252b3d8d7583f3bf33e4426e3fca802","mtr_91d902da7933e7ef62f0ebf01b25932a","mtr_e2e625094e670a444a558b76ab977f7d"],"order":3,"relationToPrevious":"cause_effect","startMs":430450,"thesis":"弱汇率曾助力日本产业和消费普及，但激烈竞争及后续升值可能把成本转嫁给劳动者，美元收入增加也未必等于实际生活改善。","title":"汇率竞争如何影响居民生活"},{"chapterId":"chapter_eeaf146be1b22201","endMs":966170,"evidenceIds":["mtr_23ba0180201d44506b40f241cfa0a76e","mtr_b850471e8233270e8f78d2f029096deb","mtr_6c6e8933cf66dd458c8638e1f7f0da3e","mtr_1e6e225041cfe13fb75d702829f16836","mtr_97ab46f5c73b1301f42e1bdded706903","mev_57d2d176e324c89ee8d7c66a6c79de78","mev_6289f8199bbcb29217c2982ec6ae499f"],"order":4,"relationToPrevious":"contrast","startMs":839400,"thesis":"中国人口庞大、地域差距显著且需要全产业链提供就业，因此不能简单复制日本式大幅升值，只能在高端发展、就业保障与货币数值间取舍。","title":"人口规模限定汇率与产业选择"},{"chapterId":"chapter_2082aea21f3a5b9b","endMs":1181080,"evidenceIds":["mtr_e72e95c539281c6105f640f2eed9e7c6","mtr_19cb470adecb735797df99599a78ade1","mtr_71f233230873805a06048c89d9a6284f","mtr_826ba9140f87ec15e529b3acb45d4976","mev_4c097d25c556f50a6e3e25b389b0f38c","mev_95a7b92d4b79ed1b3ed898481e762722","mtr_0dfb11439ed60760611b4780037ab52c","mtr_fd84eac81d592fc1fe008384aa5c6ba7","mtr_c99cce141b99d7533555d1547e4a87d7","mtr_80a1b9b04d8206c63930f54da66e0fa0","mtr_0ac964c2cd96bf8fc9b7452925bacf22","mtr_3e7ad1c5d92260e8f3f190d55c9c3c63"],"order":5,"relationToPrevious":"conclusion","startMs":966170,"thesis":"发展评价应转向普通人实际获得的物质产品与具体生活指标；基础设施、消费普及和汽车普及可在不抬高美元GDP的情况下改善实际生活。","title":"从美元数字转向实际生活供给"}],"claims":[{"claimId":"claim_8b8e3ef02199db82","evidenceIds":["mtr_c50eedfb1af8041a3a57332ff0be5bf1","mtr_9c0fbfaa83c4aa86ca5da7ee0b07f81c","mtr_068d01a1171ebbcf55febcdafc77229f"],"regions":["opening"],"text":"视频认为中国许多产业已进入全球前列并形成巨额贸易顺差，但普通人的绝对收入和购买力仍明显落后于发达国家。"},{"claimId":"claim_ad25cf8e37b26f32","evidenceIds":["mtr_ec795c19738b294d5fefa39a3f80af32","mtr_785957c11e474a9aaa4733aaa788a0bf","mtr_e01ac39dd19017014ff638fc9dbc2f38"],"regions":["opening"],"text":"汽车产业的案例被用来说明中国部分产业已具国际竞争力，但内部整合、合理盈利及普惠所有人的机制仍不成熟。"},{"claimId":"claim_aff924c4c46de75c","evidenceIds":["mtr_4c8c3d2cddb01ceb296291f47e121afc","mtr_97ad21b43a479940ab3a9937061c3879","mtr_b227b4af6ba441c4b7879e03cf8f19e1"],"regions":["opening","middle"],"text":"视频以20世纪70年代中后期日本产业起飞为历史参照，讨论技术扩张、全产业成长及日美贸易摩擦。"},{"claimId":"claim_42ca689eb801e13c","evidenceIds":["mtr_b26459c8a9cc353997325f0030d882fb","mtr_5e3bdc8dc6345a130c8df23fc4601463","mtr_e1514f50612b099c69f04af98c5e6f90","mtr_60a107a3b6afd03be63bdceb0da00f69"],"regions":["middle"],"text":"日本经验表明，弱汇率有利于产业追赶和消费普及，但激烈竞争、货币升值及产业外迁也可能把成本转移给普通劳动者。"},{"claimId":"claim_7863c855bdd6220f","evidenceIds":["mtr_23ba0180201d44506b40f241cfa0a76e","mtr_97ab46f5c73b1301f42e1bdded706903","mtr_e72e95c539281c6105f640f2eed9e7c6","mtr_0dfb11439ed60760611b4780037ab52c"],"regions":["ending"],"text":"视频主张不以美元GDP作为唯一标准，而应关注普通人实际获得的物质产品；中国受人口规模、地域差异和全产业链需求约束，难以照搬日本式汇率跃升。"}],"quality":{"failureCodes":[],"humanReviewRequired":true,"maxChapterSpanRatio":0.346503,"maxChapterStartConcentration":0.5,"sourceCoverageRatio":1.0,"status":"complete"},"receipt":{"apiKeyDisclosureCount":0,"attemptId":"attempt-132d8cbefcf0a5ad","cookieUploadCount":0,"endpointClass":"minimax_chat_completions","finishReason":"stop","frameByteUploadCount":0,"latencyMs":13503,"localPathUploadCount":0,"modelId":"MiniMax-M3","outboundDerivedTextSha256":"e2b4b167f7e2d2b137f8352a210fd85bee2c69adac49db5f7e69b0a514d3614a","providerId":"minimax-cn-openai-vision","rawAudioUploadCount":0,"rawVideoUploadCount":0,"requestCount":6,"requestSha256":"e2b4b167f7e2d2b137f8352a210fd85bee2c69adac49db5f7e69b0a514d3614a","responseSha256":"fa0a03a014c62e16635cfccd09b4fec3b1429b04cc818ce7523774b7dfabf8fc","structureMode":"openai_chat_object"},"regions":[{"availability":"substantive","endMs":394266,"evidenceIds":["mtr_c50eedfb1af8041a3a57332ff0be5bf1","mtr_9c0fbfaa83c4aa86ca5da7ee0b07f81c","mtr_068d01a1171ebbcf55febcdafc77229f","mtr_aaa7824f66beb7b5cde6743f34518b82","mtr_be806dd33c9c083c4290c4763bafc0c6","mtr_617c528971957028e663064ab1caa9c5","mev_ad15954d7e5e067f6d26ac1feaf6c4be","mev_d70aedbb98234d06c09748dfc7b95045","mtr_eb17703c542d7565aa1ddedc8c7b7a95","mtr_b7752e17c9d62bf7ab088a24b2aec91b","mtr_8b13e4ce3664cadc49d0c26c812ec871","mtr_8266e40d43b6ad479be3d18dfa941cef","mtr_ec795c19738b294d5fefa39a3f80af32","mtr_785957c11e474a9aaa4733aaa788a0bf","mev_7b48462bf5e999d7d22148b07760649d","mev_fb5cbe9bbb4d2e8c09cb93c1544a8f4d","mtr_e01ac39dd19017014ff638fc9dbc2f38","mtr_486eab36202316df1b49c43aaf666653","mtr_4c8c3d2cddb01ceb296291f47e121afc","mtr_97ad21b43a479940ab3a9937061c3879","mtr_b227b4af6ba441c4b7879e03cf8f19e1","mev_c7238827d51be399bba7068f7c83414c","mev_f237a74c399d56ddc0c82e0caedf013a"],"name":"opening","startMs":860},{"availability":"substantive","endMs":787673,"evidenceIds":["mtr_b227b4af6ba441c4b7879e03cf8f19e1","mtr_1369f47e92acf2cecf7bb722eae8bff0","mtr_b26459c8a9cc353997325f0030d882fb","mtr_5e3bdc8dc6345a130c8df23fc4601463","mtr_e1514f50612b099c69f04af98c5e6f90","mtr_60a107a3b6afd03be63bdceb0da00f69","mev_af37c05cb857502eef9f953733d15c6f","mev_f52944bae9205ad5e1ec1176a63cb6a2","mtr_1c4dbb9acf2ca42772807bc80c9dc085","mtr_366dd0f7c1d64936b82a9fb61af4c56e","mtr_d6f209839456e4bf7974d9542c3b6347","mtr_04dc864338f471177813844fd18381ce","mtr_585bc047fed80bf20c3059634f89e8cc","mev_9852cd278de3166187012505a928da38","mev_ec66b2df6aab50730bed572e1825a88d","mtr_bf6fc13ece750096f41e8fbe76f4f180","mtr_3943bacde0c569031a6ef5faf1260490","mtr_a0a4e4d704b22b8fdae8ca6608a714dd","mtr_09fab8c0aff696d64f254214aa24b9d2","mtr_4252b3d8d7583f3bf33e4426e3fca802","mev_97beaa3e517a6ec682b661479536e0c6","mev_cf6bacb952f5ab0b9fa9912c9fc36d38"],"name":"middle","startMs":394266},{"availability":"substantive","endMs":1181080,"evidenceIds":["mtr_4252b3d8d7583f3bf33e4426e3fca802","mtr_91d902da7933e7ef62f0ebf01b25932a","mtr_e2e625094e670a444a558b76ab977f7d","mtr_23ba0180201d44506b40f241cfa0a76e","mtr_b850471e8233270e8f78d2f029096deb","mtr_6c6e8933cf66dd458c8638e1f7f0da3e","mtr_1e6e225041cfe13fb75d702829f16836","mev_57d2d176e324c89ee8d7c66a6c79de78","mev_6289f8199bbcb29217c2982ec6ae499f","mtr_97ab46f5c73b1301f42e1bdded706903","mtr_e72e95c539281c6105f640f2eed9e7c6","mtr_19cb470adecb735797df99599a78ade1","mtr_71f233230873805a06048c89d9a6284f","mtr_826ba9140f87ec15e529b3acb45d4976","mev_4c097d25c556f50a6e3e25b389b0f38c","mev_95a7b92d4b79ed1b3ed898481e762722","mtr_0dfb11439ed60760611b4780037ab52c","mtr_fd84eac81d592fc1fe008384aa5c6ba7","mtr_c99cce141b99d7533555d1547e4a87d7","mtr_80a1b9b04d8206c63930f54da66e0fa0","mtr_0ac964c2cd96bf8fc9b7452925bacf22","mtr_3e7ad1c5d92260e8f3f190d55c9c3c63"],"name":"ending","startMs":787673}],"schemaVersion":"v3-media-grounded-comprehension/v2.1"}